{
  "$schema": "../../../schema/item.schema.json",
  "id": "de-cuoi-ky-co-luu-chat-hk212",
  "course": "CI2003",
  "type": "exam-past",
  "title": "Đề cuối kỳ Cơ lưu chất HK212",
  "lang": "vi",
  "license": "CC-BY-SA-4.0",
  "origin": "self-made",
  "added": "2026-10-06",
  "removed": false,
  "description": "Đề thi cuối kỳ Cơ lưu chất (CI2003) các học kỳ, bản scan hoặc PDF gốc. Một số đề có tên PGS.TS. Lê Song Giang (người phê duyệt hoặc chủ nhiệm bộ môn) và PGS.TS. Lê Văn Dực. Có thêm một đề CI2005 HK191 cùng nội dung môn.",
  "term": "HK212",
  "examKind": "ck",
  "files": [
    {
      "name": "CI2003_exam-past_de-cuoi-ky-co-luu-chat-hk212_HK212.pdf",
      "size": 1105028,
      "sha256": "bc83dc08a0caafb010db55ce7c5bc9c8e02c0e2fc4cf2c50b9b6057e45a98d99",
      "mime": "application/pdf",
      "quarantine": "pending/cBNynMBrZZ/CI2003_exam-past_de-cuoi-ky-co-luu-chat-hk212_HK212.pdf",
      "uploadSha256": "bc83dc08a0caafb010db55ce7c5bc9c8e02c0e2fc4cf2c50b9b6057e45a98d99"
    }
  ]
}
